{
  "id": "job_01JA01",
  "operation": "audio.speak",
  "client_ref": "narration-intro",
  "state": "holding",
  "outcome": "succeeded",
  "plan": {
    "model": {
      "id": "kokoro-82m",
      "title": "Kokoro 82M",
      "license": {
        "spdx": "Apache-2.0",
        "commercial_use": true,
        "terms_url": "https://huggingface.co/hexgrad/Kokoro-82M"
      }
    },
    "effective": {
      "voice": "bm_george",
      "quality": "draft",
      "language": "en-GB"
    }
  },
  "warnings": [
    {
      "code": "seed_ignored",
      "message": "Kokoro 82M doesn't use a seed; its result doesn't depend on one.",
      "param": "seed"
    },
    {
      "code": "cue_unsupported",
      "message": "Kokoro 82M can't perform [cough]; it was removed.",
      "param": "text"
    }
  ],
  "result": {
    "outputs": [
      {
        "index": 0,
        "name": "audio",
        "kind": "audio",
        "media_type": "audio/wav",
        "bytes": 412844,
        "sha256": "e0bf9670621af7c98514bd3ef55ed95e3498109f193caf9568900a56f13c2085",
        "href": "/mes/v0/jobs/job_01JA01/outputs/0",
        "duration_s": 8.6,
        "sample_rate": 24000,
        "channels": 1,
        "bit_depth": 16
      }
    ],
    "effective": {
      "voice": "bm_george",
      "quality": "draft",
      "language": "en-GB"
    },
    "provenance": {
      "engine": {
        "id": "eng_gaea01",
        "name": "Studio Gaea",
        "implementation": "gaea",
        "version": "0.9.0"
      },
      "operation": "audio.speak",
      "profile_version": "0.1",
      "model": {
        "id": "kokoro-82m",
        "title": "Kokoro 82M",
        "revision": "f3ff3571",
        "license": {
          "spdx": "Apache-2.0",
          "commercial_use": true,
          "terms_url": "https://huggingface.co/hexgrad/Kokoro-82M"
        }
      },
      "voice": {
        "id": "bm_george",
        "title": "George"
      },
      "timings": {
        "received_at": "2026-10-30T17:00:00Z",
        "run_ms": 1210
      }
    }
  },
  "retention": {
    "outputs_expire_at": "2026-10-30T18:00:02Z",
    "record_expires_at": "2026-10-31T17:00:02Z"
  },
  "created_at": "2026-10-30T17:00:00Z",
  "updated_at": "2026-10-30T17:00:02Z"
}
